{
  "files": [
    {
      "executable_lines": [
        15,
        16,
        17,
        18,
        19,
        20,
        21,
        22,
        23,
        28,
        30,
        42,
        45,
        58,
        59,
        60,
        61,
        62,
        63,
        68,
        69,
        70,
        75,
        76,
        77,
        82,
        83,
        88,
        108,
        120,
        125,
        126,
        129,
        130,
        136,
        137,
        138,
        141,
        142,
        145,
        146,
        147,
        148,
        149,
        153,
        154,
        155,
        156,
        157,
        158,
        159,
        160,
        163,
        168,
        170,
        171,
        172,
        173,
        174,
        176,
        177,
        178,
        179,
        180,
        185,
        188,
        189,
        194,
        195,
        196,
        199,
        200,
        201,
        205,
        206,
        207,
        209,
        210,
        211,
        212,
        216,
        217,
        218,
        219,
        220,
        223,
        224,
        225,
        227,
        231,
        232,
        233,
        234,
        235,
        237,
        238,
        239,
        240,
        241,
        242,
        244,
        245,
        246,
        248,
        249,
        250
      ],
      "hit_lines": [],
      "path": "netlify/functions/_data.mjs",
      "source_hash": "6c81772c679cc12463251ed776a9666620257072c0216c6a239b774bc0c739e8"
    },
    {
      "executable_lines": [
        5,
        6
      ],
      "hit_lines": [],
      "path": "netlify/functions/_prompt.mjs",
      "source_hash": "3a106370cf2b19a5476ad9b14eb5843e1ad9e8d189c24604595fc3555d7fb12d"
    },
    {
      "executable_lines": [
        14,
        15,
        18,
        19,
        20,
        21,
        22,
        23,
        24,
        26,
        29,
        32,
        33,
        34,
        35,
        42,
        43,
        44,
        45,
        48,
        49,
        52,
        53,
        54,
        55,
        56,
        57,
        58,
        59,
        60,
        63,
        64,
        67,
        72,
        73,
        74,
        75,
        76,
        78,
        79,
        80,
        81,
        82,
        83,
        85,
        86,
        87,
        88,
        89,
        90,
        95,
        96,
        97,
        98,
        100,
        105,
        106,
        107,
        112,
        113,
        114,
        115,
        116,
        117,
        118,
        120,
        121,
        122,
        123,
        124,
        126,
        131,
        132,
        143,
        144,
        145,
        146,
        147,
        148,
        149,
        159,
        160,
        161,
        162,
        164,
        165,
        166,
        168,
        175,
        176,
        177,
        178,
        179,
        180,
        181,
        182,
        183,
        186,
        187,
        188,
        189,
        190,
        192,
        193,
        198,
        199,
        206,
        207,
        208,
        209,
        210,
        211,
        212,
        213,
        214,
        215,
        216,
        217,
        218,
        219,
        220,
        221,
        222,
        223,
        224,
        225,
        226,
        227,
        230,
        231,
        242,
        243,
        244,
        245,
        246,
        247,
        248,
        253,
        254,
        255,
        256,
        257,
        258,
        263,
        264,
        265,
        266,
        267,
        268,
        269,
        270,
        271,
        272,
        273,
        274,
        275,
        276,
        277,
        278,
        282,
        283,
        284,
        285,
        287,
        291,
        292,
        299,
        300,
        301,
        302,
        303,
        304,
        305,
        306,
        307,
        308,
        311,
        312,
        313,
        314,
        315,
        317,
        318,
        319,
        320,
        321,
        326,
        327,
        328,
        329,
        330,
        331,
        332,
        333,
        334,
        338,
        339,
        340,
        342,
        343,
        344,
        345,
        346,
        351,
        352,
        353,
        354,
        355,
        356,
        357,
        358,
        360,
        361,
        362,
        363,
        369,
        370,
        371,
        372,
        377,
        378,
        379,
        380,
        381,
        382,
        383,
        384,
        385,
        393,
        394,
        395,
        396,
        397,
        399,
        409,
        410,
        411,
        412,
        413,
        414,
        415,
        416,
        417,
        418,
        419,
        420,
        427,
        428,
        429,
        430,
        431,
        432,
        433,
        438,
        439,
        440,
        441,
        442,
        443,
        444,
        445,
        446,
        448,
        449,
        451,
        452,
        453,
        454,
        455,
        456,
        459,
        460,
        466,
        471,
        472,
        473,
        475,
        476,
        477,
        478,
        479,
        480,
        481,
        482,
        483,
        484,
        485,
        487,
        488,
        489,
        490,
        491,
        500,
        501,
        502,
        503,
        513,
        538,
        539,
        540,
        541,
        543,
        547,
        551,
        553
      ],
      "hit_lines": [],
      "path": "netlify/functions/_tools.mjs",
      "source_hash": "711b5f66cf24978c47a648699c436eaf7f6095bdd49165078cf4ee28ef6f5b33"
    },
    {
      "executable_lines": [
        10,
        11,
        12,
        13,
        14,
        15,
        16,
        20,
        25,
        26,
        27,
        31,
        32,
        33,
        34,
        35,
        37,
        38,
        39,
        40,
        45,
        55,
        56,
        65,
        70,
        71,
        72,
        73,
        74,
        75,
        76,
        77,
        78,
        79,
        80,
        82,
        85,
        92,
        93,
        94,
        96,
        97,
        98,
        99,
        100,
        102,
        103,
        104,
        105,
        106,
        108,
        110,
        115,
        116,
        117,
        122,
        123,
        133,
        134,
        136,
        137,
        140,
        143,
        144,
        146,
        149,
        150,
        151,
        153,
        154,
        155,
        156,
        162,
        165,
        166,
        172,
        173,
        174,
        176,
        178,
        179,
        180,
        181,
        182,
        183,
        188,
        189,
        191,
        194,
        195,
        196,
        197,
        198,
        199,
        200,
        205,
        209,
        210,
        211,
        212,
        213,
        214,
        215,
        216,
        217,
        219,
        220,
        221,
        222,
        223,
        224,
        228,
        229,
        230,
        236,
        238,
        239,
        240,
        241,
        245,
        248,
        250,
        251,
        252,
        253,
        254,
        255,
        256,
        257,
        262,
        263,
        264,
        265,
        266,
        267,
        269,
        270,
        271,
        272,
        273,
        274,
        275,
        276,
        277,
        278,
        279,
        280,
        281,
        282,
        285,
        287,
        288,
        289,
        290,
        292,
        293,
        296,
        297,
        302
      ],
      "hit_lines": [],
      "path": "netlify/functions/chat.mjs",
      "source_hash": "db092a33a73df96ffdcfdfe87017fa15569567e7828a7a3763ca2dacb7587607"
    },
    {
      "executable_lines": [
        1,
        4,
        8,
        9,
        10,
        11,
        14,
        15,
        16,
        20,
        21,
        22,
        31,
        32,
        34,
        35,
        36,
        37,
        41,
        42,
        43,
        45,
        46
      ],
      "hit_lines": [],
      "path": "netlify/functions/rate-limit.mjs",
      "source_hash": "ded0f94649a6b75220997a91111c60fb823d5a249aa2264f5ba34ce9dcabdaf2"
    },
    {
      "executable_lines": [
        13,
        14,
        15,
        19,
        20,
        24,
        25,
        29,
        30,
        31,
        33,
        34,
        35,
        37,
        38,
        39,
        41,
        42,
        43,
        45,
        46,
        47,
        49,
        50,
        51,
        53,
        54,
        55,
        57,
        58,
        59,
        63,
        64,
        65,
        70,
        79,
        80,
        85,
        86,
        87,
        92,
        93,
        97,
        98,
        99,
        100,
        101,
        102,
        103,
        105,
        111,
        113,
        116,
        117,
        119,
        122,
        123,
        124,
        127,
        128,
        132,
        133,
        137,
        138,
        139,
        142,
        143,
        145,
        146,
        148,
        151
      ],
      "hit_lines": [],
      "path": "src/app.js",
      "source_hash": "06f5fd84648efdc920be706549bf7b2d964e1afcba2563d84528241b44b451a6"
    },
    {
      "executable_lines": [
        1,
        2,
        4,
        5,
        8,
        9,
        14
      ],
      "hit_lines": [
        1,
        2,
        4,
        8,
        14
      ],
      "path": "src/browser-storage.js",